{
  "$schema": "https://json-schema.org/draft/2020-12/schema",
  "$id": "https://mdbase.dev/connect/schemas/mdbase-app.v1.json",
  "title": "mdbase connect bundled application manifest v1",
  "type": "object",
  "additionalProperties": false,
  "required": ["manifest_version", "id", "name"],
  "properties": {
    "manifest_version": { "const": 1 },
    "distribution": {
      "enum": ["web", "portable"],
      "description": "Portable declarations use device authorization and do not claim a browser origin."
    },
    "id": {
      "type": "string",
      "minLength": 5,
      "maxLength": 150,
      "pattern": "^[a-z][a-z0-9-]*(\\.[a-z][a-z0-9-]*){2,}$",
      "description": "Stable reverse-domain application identifier. This is presentation metadata, not publisher authentication."
    },
    "name": { "type": "string", "minLength": 1, "maxLength": 100 },
    "platform": { "const": "native", "description": "Unverified native app; permits literal IPv4 loopback HTTP on any port." },
    "homepage": { "type": "string", "format": "uri", "pattern": "^https://" },
    "project_url": { "type": "string", "format": "uri", "pattern": "^https://" },
    "icon": { "type": "string", "format": "uri", "pattern": "^https://" },
    "redirect_uris": {
      "type": "array",
      "minItems": 1,
      "maxItems": 10,
      "uniqueItems": true,
      "items": {
        "type": "string",
        "format": "uri",
        "description": "An HTTPS URI on the homepage origin or a private-use scheme derived from the application ID."
      }
    },
    "installation_origins": {
      "type": "object",
      "additionalProperties": false,
      "properties": {
        "lab": { "$ref": "#/$defs/installationOriginPolicy" },
        "staging": { "$ref": "#/$defs/installationOriginPolicy" },
        "production": { "$ref": "#/$defs/installationOriginPolicy" }
      }
    },
    "requirements": { "$ref": "#/$defs/requirements" },
    "provisions": {
      "type": "object",
      "additionalProperties": false,
      "required": ["type_packs"],
      "properties": {
        "configuration": {
          "type": "array",
          "maxItems": 50,
          "items": { "$ref": "#/$defs/configurationProvision" }
        },
        "type_packs": {
          "type": "array",
          "maxItems": 20,
          "items": { "$ref": "#/$defs/typePackProvision" }
        }
      }
    },
    "notifications": {
      "type": "object",
      "additionalProperties": false,
      "required": ["criteria"],
      "properties": {
        "criteria": {
          "type": "array",
          "maxItems": 50,
          "items": { "$ref": "#/$defs/notificationCriterion" }
        },
        "native_delivery": { "$ref": "#/$defs/nativeNotificationDelivery" }
      }
    }
  },
  "oneOf": [
    {
      "required": ["homepage", "redirect_uris"],
      "properties": {
        "distribution": { "const": "web" },
        "homepage": true,
        "redirect_uris": true,
        "project_url": false
      }
    },
    {
      "required": ["distribution"],
      "properties": {
        "distribution": { "const": "portable" },
        "platform": false,
        "homepage": false,
        "redirect_uris": false
      }
    }
  ],
  "$defs": {
    "installationOriginPolicy": {
      "type": "object",
      "additionalProperties": false,
      "properties": {
        "app-runtime": { "$ref": "#/$defs/installationOrigins" },
        "mobile": { "$ref": "#/$defs/installationOrigins" }
      }
    },
    "installationOrigins": {
      "type": "array",
      "maxItems": 16,
      "uniqueItems": true,
      "items": { "type": "string", "minLength": 1, "maxLength": 255, "format": "uri" }
    },
    "identifier": {
      "type": "string",
      "minLength": 1,
      "maxLength": 100,
      "pattern": "^[a-z0-9]+(?:[._-][a-z0-9]+)*$"
    },
    "duration": {
      "type": "string",
      "pattern": "^[0-9]+(ms|s|m|h|d)$"
    },
    "contract": {
      "type": "object",
      "additionalProperties": false,
      "required": ["id", "version", "digest"],
      "properties": {
        "id": { "$ref": "#/$defs/identifier" },
        "version": {
          "type": "string",
          "pattern": "^(0|[1-9][0-9]*)\\.(0|[1-9][0-9]*)\\.(0|[1-9][0-9]*)(?:-[0-9A-Za-z-]+(?:\\.[0-9A-Za-z-]+)*)?(?:\\+[0-9A-Za-z-]+(?:\\.[0-9A-Za-z-]+)*)?$"
        },
        "digest": { "type": "string", "pattern": "^sha256:[0-9a-f]{64}$" }
      }
    },
    "requirements": {
      "type": "object",
      "additionalProperties": false,
      "required": ["access", "contracts"],
      "properties": {
        "capabilities": { "$ref": "#/$defs/capabilityRequirements" },
        "access": {
          "const": "full_collection",
          "description": "Compatibility declaration for collection-level application authorization."
        },
      "collection_kind": {
          "const": "hosted",
          "description": "Require a durable provider-backed collection with direct sync support."
        },
        "people": {
          "type": "object",
          "additionalProperties": false,
          "required": ["version"],
          "anyOf": [{ "required": ["required"] }, { "required": ["optional"] }],
          "properties": {
            "version": { "const": 1 },
            "required": { "$ref": "#/$defs/peoplePermissions" },
            "optional": { "$ref": "#/$defs/peoplePermissions" }
          }
        },
        "files": { "$ref": "#/$defs/fileRequirement" },
        "configuration": {
          "type": "array",
          "maxItems": 50,
          "items": { "$ref": "#/$defs/configurationRequirement" }
        },
        "contracts": {
          "type": "array",
          "maxItems": 20,
          "uniqueItems": true,
          "items": { "$ref": "#/$defs/contract" }
        }
      }
    },
    "capabilityRequirements": {
      "type": "object",
      "additionalProperties": false,
      "required": ["contract_version", "required"],
      "properties": {
        "contract_version": { "const": 2 },
        "required": {
          "type": "array",
          "maxItems": 32,
          "uniqueItems": true,
          "items": { "$ref": "#/$defs/applicationCapability" }
        },
        "optional": {
          "type": "array",
          "maxItems": 32,
          "uniqueItems": true,
          "items": { "$ref": "#/$defs/applicationCapability" }
        }
      }
    },
    "configurationValue": {
      "anyOf": [
        { "type": "string" },
        { "type": "number" },
        { "type": "boolean" },
        { "type": "null" }
      ]
    },
    "configurationRequirement": {
      "type": "object",
      "additionalProperties": false,
      "required": ["id", "path", "predicate", "value"],
      "properties": {
        "id": {
          "type": "string",
          "minLength": 1,
          "maxLength": 100,
          "pattern": "^[a-z][a-z0-9]*(?:-[a-z0-9]+)*$"
        },
        "path": { "type": "string", "minLength": 1, "maxLength": 1024 },
        "predicate": { "const": "contains" },
        "value": { "$ref": "#/$defs/configurationValue" }
      }
    },
    "configurationProvision": {
      "type": "object",
      "additionalProperties": false,
      "required": ["requirement", "operation", "path", "value"],
      "properties": {
        "requirement": {
          "type": "string",
          "minLength": 1,
          "maxLength": 100,
          "pattern": "^[a-z][a-z0-9]*(?:-[a-z0-9]+)*$"
        },
        "operation": { "const": "set_add" },
        "path": { "type": "string", "minLength": 1, "maxLength": 1024 },
        "value": { "$ref": "#/$defs/configurationValue" }
      }
    },
    "applicationCapability": {
      "enum": [
        "collection.read",
        "records.create",
        "records.edit",
        "records.delete",
        "views.manage",
        "definitions.manage",
        "background.schedule",
        "offline.replica"
      ]
    },
    "peoplePermissions": {
      "type": "array", "minItems": 1, "uniqueItems": true,
      "items": { "enum": ["identity", "members"] }
    },
    "fileRequirement": {
      "type": "object",
      "additionalProperties": false,
      "required": ["required", "scope"],
      "properties": {
        "required": { "$ref": "#/$defs/fileActions" },
        "optional": { "$ref": "#/$defs/fileActions" },
        "scope": { "$ref": "#/$defs/fileScope" }
      }
    },
    "fileActions": {
      "type": "array",
      "minItems": 1,
      "maxItems": 6,
      "uniqueItems": true,
      "items": {
        "enum": ["list", "read", "add", "replace", "move", "delete"]
      }
    },
    "fileScope": {
      "oneOf": [
        {
          "type": "object",
          "additionalProperties": false,
          "required": ["kind", "folders"],
          "properties": {
            "kind": { "const": "selected_folders" },
            "folders": {
              "type": "array",
              "minItems": 1,
              "maxItems": 100,
              "uniqueItems": true,
              "items": {
                "type": "string",
                "minLength": 1,
                "maxLength": 1024,
                "pattern": "^(?!/)(?!\\.)(?!.*//)(?!.*\\\\)(?!.*/\\.)(?!(?:_contracts|_schemas|_types|_views|node_modules)(?:/|$))(?!.*\\/(?:_contracts|_schemas|_types|_views|node_modules)(?:/|$))(?!.*/$).+$"
              }
            }
          }
        },
        {
          "type": "object",
          "additionalProperties": false,
          "required": ["kind"],
          "properties": { "kind": { "const": "collection" } }
        }
      ]
    },
    "typePackProvision": {
      "type": "object",
      "additionalProperties": false,
      "required": ["manifest", "resources", "provides"],
      "properties": {
        "manifest": { "$ref": "#/$defs/typePackManifest" },
        "resources": {
          "type": "array",
          "minItems": 1,
          "maxItems": 100,
          "items": { "$ref": "#/$defs/typePackSourceResource" }
        },
        "provides": {
          "type": "array",
          "maxItems": 20,
          "uniqueItems": true,
          "items": { "$ref": "#/$defs/contract" }
        }
      }
    },
    "typePackManifest": {
      "type": "object",
      "required": ["kind", "id", "version", "resources"],
      "properties": {
        "kind": { "const": "mdbase.type-pack" },
        "id": { "$ref": "#/$defs/identifier" },
        "version": { "$ref": "#/$defs/contract/properties/version" },
        "name": { "type": "string", "minLength": 1, "maxLength": 100 },
        "description": { "type": "string", "maxLength": 500 },
        "resources": {
          "type": "array",
          "minItems": 1,
          "maxItems": 100,
          "items": { "$ref": "#/$defs/typePackManifestResource" }
        }
      },
      "patternProperties": { "^x-[A-Za-z][A-Za-z0-9._:-]{0,127}$": true },
      "additionalProperties": false
    },
    "typePackManifestResource": {
      "type": "object",
      "additionalProperties": false,
      "required": ["kind", "mode", "source", "target", "digest"],
      "properties": {
        "kind": { "enum": ["contract", "type", "schema"] },
        "mode": { "enum": ["managed", "seed"] },
        "upgrade_from": {
          "oneOf": [
            { "$ref": "#/$defs/typePackUpgradeBaseline" },
            { "type": "array", "minItems": 1, "items": { "$ref": "#/$defs/typePackUpgradeBaseline" } }
          ]
        },
        "source": { "type": "string", "minLength": 1, "maxLength": 240 },
        "target": { "type": "string", "minLength": 1, "maxLength": 240 },
        "digest": { "type": "string", "pattern": "^sha256:[0-9a-f]{64}$" }
      }
    },
    "typePackUpgradeBaseline": {
      "type": "object",
      "additionalProperties": false,
      "required": ["digest", "document"],
      "properties": {
        "digest": { "type": "string", "pattern": "^sha256:[0-9a-f]{64}$" },
        "document": { "type": "string", "maxLength": 262144 },
        "version": { "type": "integer", "minimum": 1 }
      }
    },
    "typePackSourceResource": {
      "type": "object",
      "additionalProperties": false,
      "required": ["source", "document"],
      "properties": {
        "source": { "type": "string", "minLength": 1, "maxLength": 240 },
        "document": { "type": "string", "maxLength": 262144 }
      }
    },
    "notificationCriterion": {
      "type": "object",
      "additionalProperties": false,
      "required": ["id", "event", "presentation"],
      "properties": {
        "id": { "$ref": "#/$defs/identifier" },
        "event": { "$ref": "#/$defs/contract" },
        "if": {
          "type": "object",
          "additionalProperties": false,
          "required": ["$expr"],
          "properties": {
            "$expr": { "type": "string", "minLength": 1, "maxLength": 4096 }
          }
        },
        "debounce": { "$ref": "#/$defs/duration" },
        "minimum_interval": { "$ref": "#/$defs/duration" },
        "presentation": {
          "type": "object",
          "additionalProperties": false,
          "required": ["title"],
          "properties": {
            "title": { "type": "string", "minLength": 1, "maxLength": 80 },
            "body": { "type": "string", "maxLength": 160 },
            "tag": { "type": "string", "minLength": 1, "maxLength": 80 }
          }
        }
      }
    },
    "nativeNotificationDelivery": {
      "oneOf": [
        {
          "type": "object",
          "additionalProperties": false,
          "required": ["mode", "firebase_project_id"],
          "properties": {
            "mode": { "const": "managed_fcm" },
            "firebase_project_id": {
              "type": "string",
              "minLength": 6,
              "maxLength": 63,
              "pattern": "^[a-z][a-z0-9-]*[a-z0-9]$"
            }
          }
        },
        {
          "type": "object",
          "additionalProperties": false,
          "required": ["mode", "url"],
          "properties": {
            "mode": { "const": "webhook" },
            "url": {
              "type": "string",
              "format": "uri",
              "pattern": "^https://"
            }
          }
        }
      ]
    }
  }
}
